{
  "$schema": "./config.schema.json",
  "target": "pi",
  "models": {
    "fast": "openai-codex/gpt-5.6-terra",
    "balanced": null,
    "auxiliary": null
  },
  "thinkingLevels": {
    "fast": "high",
    "balanced": null,
    "auxiliary": null
  },
  "toolGroups": {
    "core": ["read", "grep", "find", "ls"],
    "agent": [],
    "browser": [],
    "edit": [],
    "memory": [],
    "exo": [],
    "terminal": ["bash"],
    "terminal-minimal": ["bash"],
    "testing": [],
    "tasks": [],
    "github": []
  }
}
